reviewText,True_sentiment,category
This isc ute but very small Do not thinki t's worth the price I tis very soft Doesn'ts eem to keep kids intrigued,negative,"typos, expand contractions, remove punctuation"
"Ok, so this is not a review for this CD in particular but I feel that it doesnt really matter as how I suspect all of This genlteman's cds probably sound the same I have to listen to ""piano for stress relief"" by thsi guy On repeat, with another Gem of a ""stress relief "" cd at work, on repeat everyday, for 6 hourss traight Yeh Yeh, I can smell it in your hair, Your thinking "" Oh Gee hWiz, that sounds great, I wish my work would let me listen to that everyday no, you dont, what is wrongw ith you Sure this stuff may be relaxing if you listen to it once every decade, but constantly, its almost enough to drive you insane, which is why Ia m here on amazon writing a review, bored (and out) of my mind thanks ofr listening, amazon ah",negative,"typos, expand contractions, remove punctuation"
Thakns,positive,"typos, expand contractions, remove punctuation"
This was one of the best albums of 1978 from beginning to end i never thought it would see the light of day thank you BBR I have just pucrhase (If the price is right) great album please do not leave the fans hanging please release the Purple album i had heard that all the tracks did not make it on the original album please find those and add them to BBR you are a life saver it is such a shame that so much good music will not see the light of day,positive,"typos, expand contractions, remove punctuation"
"The 2nd solo album from BONNIE POINTER is another self-titled album title, which features mostly remakes of Motown oldies, featuring a purple cover with ad rawing of her Ultimately, it is not as rewarding as her excellent 1st solo album released just one year prior to this that ahs a red cover I do not know why the decision wsa to redo more old Motown songs from the 60's , whether it was her decision, producer Jeffrey Bowen or Motown Only 6 songs, with only 1 song being an original new song, EDEP IN MY SOUL, which is excellent It is a ballad much in the vein of the inventive tunes on he r1st album It is what this album should have contained more of - original umsic As for the other 5 songs, I guess sicne HEAVEN MUST HAVE SENT YOU was a big hit, they combed the Motown catalog for more classics to redo It is far too many to have odne Waht should have been a step forward in doing more progressive music like on her 1st album, was instead a fatal error that pretty much ended her solo career This easily could have been an EP, and probably shuold have been only that, not a 2nd full album of remakes Of these  ICAN'T HELP MYSELF , JIMMY MACK, WHEN THE LOVELIGHT STARTS SHINING THROUGH HIS EYES are the best The arrangements are at least new & idfferent than the original versions But really, how could she otp the original versions It is a case ofo verdoing it Even the presecne of SLY STONE and FREDDIE STEWART paying on 2 songs does not add up to much, as well as OLLIE E. BROWN, TRUMAN THOMAS and NATHAN EAST - all top session men I once read that there were more recordings don efor her 2nd album, but they were shelved in place of this Grav eerror This could have advanced Bonnie's career had it been filled with great songs like her s1t And why name it OBNNIE POINTER like the 1st Al lit has done is confuse people So, if you like Bonnie's singing, and she sings great on here, or Motown oldies remade, you will lik ethis Otherwise, get her 1st slo album - i tIS amazing Bonnie ledt Motown after this album, and recorded one more solo album, IF THE PRICE IS RIGH,T in 1984 for the Private I label That is better tahn this album, features all original songs, and even has Ruth & Anita singing background vocals on 2 songs The Pointer Sisters , of course, were now platinum recording artists with a string of iht singles and albums A shame she will not be let back into the group ,but since she left in 1978, that was it for her with her sisters as a group Relaesed in late 1979 on MOTOWN M7-929R1 with the purple cover Songs: I Cannot HELP MYSELF, JIMMYM ACK, WHEN THE LOVELIGHT STARTS SHINING THROUGH HIS EYES, DEEP INSIDE MY SOUL, COME SEE ABOUT ME, NOWHERE TO RUN",negative,"typos, expand contractions, remove punctuation"
"Sometimse you get what you pay for In thisc ase, no mention was made that this was only one of the two-CD set I have loved thisa lbum for years, but if I want all of it, I guess I will have to pay the piper and buy a new set",negative,"typos, expand contractions, remove punctuation"
Some folks are saying they onyl got half the selection I got it all and it was a fnu CD to listen to,positive,"typos, expand contractions, remove punctuation"
There are only 8 songs on the DC I was expecting mcuh more The dsecription must have said this but I missed it I went and bought a Best of Elton John CD that I enjoy and thrwe this on away Chalk it up to learning the hard wa yto read the description closer,negative,"typos, expand contractions, remove punctuation"
"Who on earth thouhgt it a good idea to sell this An incessant whine heard over and over, witha ll the pop of a squishy fart Absolutely horrid and I am  ahuge BB fan",negative,"typos, expand contractions, remove punctuation"
"I am sooooo dispapointed I specifically ordered this C Dbecause as kids we would listen to it all the time I am 59 yearso ld and I still can sing all the songs The original vinyl that I listened to back in the day, has 12 tracks (sonsg) on it This CD I just got olny has 10 They left out the 2 best songs on the album, ""aMp of the World"" and ""If it Fits Your Fancy I bought this CD as a Christmas gift for my sister who is favorite song on the album is ""Map of th eWorld We would sing it together ,it is so clever and funny When I opened the package after I received this order in the mail, I imemdiately checked the back for all the songs No where on the sellers web site did it list the names of the songs on hte CD Iw as so let down when I did not see this two songs Does anyone know where I can buy a CD with all original 12 trakcs (songs It will be a ""Blue Christmas"", blue a sin depressed",negative,"typos, expand contractions, remove punctuation"
"I bought this cd because of the song ""nOe Pair of Hands"" It was said that Elvis recorded this song however it was not Elvis it is Mr. Robinson and his whole CD is just beautiful and he does somewhat sound like Elvis",positive,"typos, expand contractions, remove punctuation"
The titl eand reviews are for classic rock The muisc offered here is classical music A bit of a deprature.... After reading the reviews I was ready to buy Will loko for this elsewhere Jrei,negative,"typos, expand contractions, remove punctuation"
Some godo music from the past that gets only light current radio play (I have not heard the Knack since they burned brightly and faded just as quickly And most o fthese will not get much play 30 years from now so owning this set is an affordable way to get 25 chart-quality songs not heard much today,positive,"typos, expand contractions, remove punctuation"
"This album is absolutely the crown of everything good that the 80's rock bansd aspired to in terms of energy and attitude The first six songs- Shotgun Sally, Nine Lives, Her Monkey, Whip it Out, Long WayF rom Home and Coast to Coast- are top notch high tempo, face-ripping hard rock, dripping raw energy and sleaze despite the ultra polished production The album's one ""eh"" point is next with the custoamry ballad ""Every Sunrise"", a few steps above the typical vomit-inducing dreck of the day like Warrant's ""Heaven"", but still little more than breathing room before picking up again with the funkier mid-tempo ""Evil Angel"" and ""Bad Boys are Back""(great song despite the cringeworthy title), then sprinting to the finish with high speed closer ""Heaven on a Heartbeat Isi t deep Of coruse not, it is 1989 But if you want to push the envelope beyond Poison and Wrarant and the like, without going full-on metal, take a listen to this band....and do not blame me for the speeding ticket",positive,"typos, expand contractions, remove punctuation"
It is nice music but was not like the anointed  Worship Music I hoped it to be,negative,"typos, expand contractions, remove punctuation"
"I listened to the sample of this recording and was struck by how overrwought and melodramatic Ms. Crowe had made her interpretation I eprsonally cannot see this as a song about histrionics but about reflection on love and loss Mr. Cohen illustrates what it is to lose a love later in life after a long relationship, Mr. Buckley's interpretation is of a young man who has lost the love of his life and will never love that way agian Both of these recordings are looking back from a place fo acceptance and reflection Ms. Voegele has recorded a version which captures what it feels like to have just lost that olve and the wounds have not had time to scab over Like Job she is not willing to accept that her suffering is just, nor iss he willing to ""curse God and die",negative,"typos, expand contractions, remove punctuation"
the song taht was bought was not the version of the song i heard on pandora i would like the dancem ix to add to my party library,negative,"typos, expand contractions, remove punctuation"
"This isa  song that I heard as a ""golden oldie"" when I first listened to rock and roll in the early sixties It has a haunting melody, an dI still like it This recording is in stereo, though the fidelity is not all it could have been,e ven at the time Said to have been released in 1959, it is probably rechanneled for stereo from a mono orgiinal Contrayr to a popular myth, ""Sleepwalk"" by Ultravox is NOT a cover of this song T(hat's a joke",positive,"typos, expand contractions, remove punctuation"
